Key;Reasoning
22168020;To create the output first the input is copied and then zero-values between two non-zero values turned into the same non-zero values they are surrounded with. Dimensions: Output dimensions therefore are the same as in the input. Values: The output uses the same values as the input. Changes values: As explained earlier the only values that change are the horizontal lines of zero values between two non-zero values.
23581191;First the input is copied and then for each non-zero value we fill a horizontal and vertical line with the same non-zero value. If two lines cross each other the entry gets the value 2 at that point. Dimensions: Therefore the output dimensions are the same as the input dimensions. Values: The non-zero values of the input define the values on the added vertical and horizontal lines (except in the case of crossed lines). Changed Values: For each non-zero value in the input the whole vertical and horizontal line of that entry will be changed.
29623171;First the input is copied into the output. Secondly the we see the two-dimensional grid as a nine three by three grids divided by the values equal to five. Then we look at the three by three grids and observe the one with the most non-zero values x in it. There can be multiple with the most non-zero values x in it. Once observed the three by three grids with the most non-zero values x are turned into a three by three grid where all values are x. All other three by three grids are zerod out while the fives remain. Dimension: The output has the same dimensions as the input. Values: Following the general rule explained earlier there are usuall only two non-zero values used one is 5 and one is dependent on the input we call it x. Changed values: Following the rule earlier we on one hand change the values in the three by three grid with the most non-zero values and we change the non-zero values to zero which are in the other three by three grids.
32597951;First the input is copied and then one looks at the rectangle that is formed by the eights and observes which 1 value overlaps with the rectangle of the eights. Once the overlapping ones got identified they are turned into the value 3. Dimension: The input and the output has the same dimension as we only modify the values of the copied input and don't add anything. Values: The only values used are eights, threes, ones, and zeros. Changed values: Following the explanation only the one values are changed which seem to be overlapping with the rectangle of eights.
40853293;First the input is copied and then we look for two equal values in the same line no matter if it is a horizontal or vertical line. Once we identified such a pair we set every value between these two values to the same value as the identified pair has. If two lines cross each other the value of the vertical line has priority. Dimension: The dimensions stay the same as we copy from the input but don't add anything, we only change values within the same dimensions. Values: Based on the description earlier we only use values seen in the input. Changes values: Based on the description earlier we only change zero-values inbetween two equal values and cross points of two lines where we have grant the priority value to the vertical line.
50846271;First the input is copied and then the values equal to two are identified. Values equal to two indicate a subset of a pluss sign with five vertical points and five horizontal points. Since the values equal to two are usually only subset they are filled up to the 5 by 5 plus sign with values equal to eight. All the other values which don't interfere with the 5 by 5 plus signs aren't changed. Dimension: The dimensions stay the same since the input is copied and nothing is added only values within the given dimensions are changed. Values: The only used values are in the solution should be 0,5,2, and 8. If a value is change from input to output is has to be change to 2 since these are the only values we add. Changed values: Only values not equal to eight are changed which interfere with the imagined 5 by 5 plus sign.
63613498;First the input is copied then one observes which structure is displayed in the top left corner and memorizes the valuex held by the structure. By displayed I mean which one is surrounded by the dimension boundaries and fives. Once the displayed structure and the value x is known one searches in the rest of the grid for this structure and if found lessens the value y of the outer structure by x. All other entries stay untouched. Dimension: This means that the dimension stays unchanged since we don't add anything and only change values from the copied input. Values: The only values used are therefore the same values as seen in the input and x-y (if x-y<0 then use 0). Changed values: Only the the tiles which have the same structure as the displayed one in the top left corner are changed everything else remains the same.
82819916;First the input is copied and then the pattern of the horizontal top non-zero line which goes from the left bound to the right bound is observed and memorized. The patter is then copied to each indicated line just with the respective values of the line-indication. A line is indicated if the first three values from left to right are non-zero. Dimension: The dimensions therefore stay the same. Values: Only values that are used in the input are used in the output again. Changed values: Only zero values being in the same row as an indicated line will be changed.
91413438;First the zero-values of the three by three input are count assume that there are x zero values. Then the dimensions are set such that the width and height are (x times 3). As it is a three by three grid the non-zero values are therefore 9-x. Now going from left to right and top to bottom insert (9-x) three by three consecutive input grids without them overlapping each other. Dimension: This means for the dimensions of the output that it is a (x times 3) by (x times 3) grid. Values: The used values are the same as seen in the input. Changed values: The values changed therefore depend on the input three by three grid in a sense that we copy the input grid consecutively into the output grid without overlapping. By non-overlapping I mean that if we insert the grid at the top left corner (0,0) the next copied input grid can only start at (3,0).
95990924;First the input is copied and then one observes the squares of fives. Once they are observed one takes a diagonal step into the zero value at each corner five and changes the value as follows: if step taken from the top left corner change value to 1. If step taken from the top right corner change value to 2. If step taken from the bottom left corner change value to 3. If step taken from the bottom right corner change value to 4. Dimension: The input dimension is therefore the same as the output dimension. Values: The only values used in the output should be 0,1,2,3,4,and 5. Changed values: Change only the values which are part of the surrounding frame of zeros which surround the squares of fives. 
97999447;First the input is copied. Then for each non-zero value x we complete a horizontal line to the right of that value by alternating the value x and five until the boundarie is reached. Do that for all non-zero values of the copied input. Dimension: As we only change values within the boundaries of the copied input and don't add anything the dimensions of input and output are the same. Values: Only use the seen values of the input and five. Changed values: Only change values to horizontal right of non-zero values from the copied input.
007bbfb7;Each non-zero entry in the input takes the whole input-grid and copies it into the position the non-zero entry was without changing the value. From that follows: Dimension: The input dimensions get squared. Values: The non-zero entries don't differ in values from input to output. Changed values: Copy the whole input grid into the same position of the output grid if the value is non-zero at that position in the input-grid.
00d62c1b;First the input gets copied and second the encircled zero values of the input are turnt into the same non-zero value in the output. From that follows: Dimension: Going from input to output the dimension stay the same. Values: The non-zero entries of the input have the same non-zero value in the output. The encircled zero values receive all the same non-zero value which is different from the non-zero values of the input. Changed values: Only the encircled zero values of the input change their values to non-zero values.
017c7c7b;First the input gets copied and then the top 3x3 grid gets appended to the bottom such that the pattern is enlarged by one 3x3 block. The non-zero values used all change uniformly to another non-zero value. From that follows: Dimension: Since a 3x3 grid is appended at the bottom the width dimension of the grid stays the same but the height of the grid is enlarged by three. Values: All non-zero values change their non-zero value uniformly to the same new non-zero value. Changed values: All non-zero values are changed as described and the newly appended 3x3 grid follows the same non-zero pattern as the top 3x3 grid just with the new non-zero value.
025d127b;First the input is copied and then one observes each structure of equally values non-zero values. The observed structures have a bottom part which is shaped like a L which has fallen to the left, this fallen L of the structure is stationary and won't change in the output. The rest of the structure is all shifted one tile to the right. Dimension: The dimension is the same in the input and the output since the only thing we do is shifting a part of the structure to the right. Values: The used values are the same as in the input. Changed values: The changes values are only the left and right boundarie values of the part of the structure being moved and the zero-values to the right of the moving part of the structure where the structure is moved to.
045e512c;First the input is copied and the base structure of non-zero values is observed. One can find the base structure by obsering the structure which is a superset of all the other structures. Once this base structure is obeserved it is continued for the unfinished indication of the structer with the same pattern and value showed by the indication. Dimension: As we copy the input and only work on the values within the copied boundaries the dimensions of input and output are the same. Values: Also we only use values already seen in the input since the only thing indicating a value usage are values used in the input. Changed values: Only change values that lie on line drawn from the base structure to the indicated structure and only change values used to fulfill the indicated base structures.
0520fde7;Imagine the 5 values as wall seperating two 3 by 3 grids. Then observe within the seperated 3 by 3 grids which one values would overlap when one would combine the 3 by 3 grids. The create a 3 by 3 output grid and turn the positions of the overlapping ones to the value 2. Dimension: The output has the dimension of the two seperated grids in our case this is 3x3. Values: Only use zero and two in the output. Changed values: Only change the value of the position which would be overlapping one values when one would lay the two seperated 3x3 grids over each other.
5269061;First copy the input and look the three example diagonals then continue the pattern by taking the value of a diagonal, skip the following two diagonals and then change the zero-values diagonal to the memorized value. Do that with all three example diagonals and the output should usually be diagonally striped grid. Dimension: Since nothing is added nor is it cut of the input and the output have the same dimensions. Values: The values used in the output should only be non-zero and only the seen non-zero values fom the input should be reused. Changed values. Since the diagonally striped pattern has to be set up only change the zero values from the copied input.
05f2a901;Copy the input and only change the position of the structure with the values equal to 2, the structure with the values 8 remains untouched. The structure of the values with 2 is shifted towards the structure with the values 8 such that both structures touch each other but don't overlap. Dimension: The input and output have the same dimension since the only modification is the shifting of the structure filled with 2s. Values: The only values used are 0, 2, and 8. Changed values: Only change the values such that the shifting effect is created without showing any modifications along the shifted way.
06df4c85;First copy the input then imagine it as many 2x2 grids divided by the the fours. Once that is understood find 2x2 grids that have the values (x) in it and connect them by making all the zero values along the way to value x. When connecting them always move in a straight line to the nearest 2x2 grid having the same input values. Do that for all 2x2 grids which have a partner 2x2 grid with the same value. Dimensions: The output has the same dimension as the input. Values: The values used are all seen already in the input. Changed values: Only change zero values connecting two partnering 2x2 grids with the same value in a straight line of 2x2 grids divided by the fours.
08ed6ac7;First the input is copied and then one has to image the different values as bars of fives. The fourth biggest bar will be turned into values of 4, the third biggest to values of 3, the second biggest to values of 2, and the biggest to values of 1. Dimension: As we only copy the input and change the values of the bars the dimension stays the same. Values: The only used values in the output will be 0, 1, 2, 3, and 4. Changed values: Only the values equal to five in the copied input will be changed in the input.
09629e4f;Look at the input grid and imagine it as nine 3x3-grids divided by line of values equal to five. Then look at each of the 3x3 grids and search for the one with just four non-zero values in it and memorize it. Once this grid has been detected create nine 3x3 grids divided by lines of fives and copy the pattern of the 3x3 grid memorized earlier just into bigger scale. This means for example if the top left entry of the memorized 3x3 grid is red then the top left 3x3 grid of the output should all be red. Dimension: The dimension of the output therefore is the same as seen in the input. Values: The used value are 0,5, and the four values seen in the memorized 3x3 grid of the input. Changed values: Starting from nine 3x3 grids filled with zeros and divided by lines of fives we change the 3x3 grids which are at a position of a non-zero value in the memorized 3x3 grid of the input.
0962bcdd;First copy the input then observe the non-zero plus structures and extend the middle value diagonally for two entries in each diagonal direction. Also extend the outer values by one in each straight direction. Dimension: As we copy the input and don't add anything we the output dimension is the same as the input dimension. Values: Only use the values seen in the input. Changed values: Only change the value in a diagonal line from the middle of the plus structure and the ones next to the outer values of the plus structure.
0a938d79;First copy the input then detect the non-zeron values and complete vertical lines with the same value. Then detect the pattern and continue it to the right until the boundaries are reached. Dimension: The dimensions stay the same because we copy the input and don't add anything to it other than changing zero values. Values: All values in the output have to be seen in the input already. Changed values: Only change value on a vertical line of the initial non-zero values of the input and zero values which lie on the pattern positions we want to continue.
0b148d64;There are three regions with the same value x and one region with another value y in the input. Look at the region with value y and create the output such that the region perfectly fits into it without changing any value. Dimension: The dimension depends on the region of value y, it should be rectangular in such a sense that it perfectly fits the region with value y into it. Values: The only values used in the output will be 0 and y. Changed values: Technically values aren't changed just parts of the input are cut off.
0ca9ddb6;First copy the input and then extend each value equal to 2 with a 4 in each diagonal direction and extend each value of 1 in each horizontal and vertical direction with a value of 7. This gives the desired output. Dimension: The dimension stays the same as the input is copied and not extended afterwards. Values: The values used in the output are the ones already seen in the input plus 1 and 7. Changed values: Only change 0 values being directly next to a 2 in a diagonal sense and zero values being horizontally or vertically next to a 1.
0d3d703e;Copy the input and change values as following (1->5,2->6,3->4,4->3,5->1,6->2,8->9,9->8). Dimension: The dimensions stay the same since we copy from the input and only change the values. Values: The used values depend on the seen values in the input following the rule described earlier. Changed values: Every value is changed when going from input to output.
0dfd9992;First copy the input then the only goal is to get rid of the zero-values destroying the pattern which is already visible. Figure out the underlying pattern and change the zero values step by step by looking for other parts in the input which look similar and see how they were handled in that case. Dimension: Dimensions stay the same since we only copy the input and change the zero values but don't extend it. Changed values: Change only zero values from the copied input.
0e206a2e;First copy the input then look at the connected structure and think about how it needs to be rotated such that it can fit into one of the distributed entries of non-zero values. Do that for both connected structures. Once this is figured out shift and rotate them such that they overlap the distributied non-zero values and fill the old position with zero values. Dimension: The dimension stays the same since we copy the input and don't extend it. Values: All values used in the output are already seen in the input. Changed values: Change the values of the old positions of the connected structures to 0 and change the values of the new positions such that they resemble the connected structures from the input again.
10fcaaa3;First double the dimension of the input then copy the input 4 times. One time paste it into the top left corner,then the top right, then the bottom left, and then the bottom right. Once done look at each non-zero value in the grid thats created and extend the neighboring diagonal entry of each non-zero value in a sense that you change the value if it is 0 to 8. The resulting grid is the solution. Dimension: The dimensions are double along both axis. Values: Only use values already seen in the input and 8. Changed values: Change the values being zero and a diagonal neighbor of the grid you prepared with copying the input four times into the new dimensions.
11852cab;Copy the input and then extend the already started structure such that is becomes a 5x5 structure where non-zero values are only neighboring diagonally and the pattern of the non-zero values follow the started structure from the input. Dimension: The dimension stays the same since we only copy the input and then change values. Values: The values used in the output are all already seen in the input. Changed values: Change only zero values to fulfill the structure desired and never change a zero value such that two non-zero values are neighboring horizontally or vertically.
1190e5a7;Observe the input and try to find the domination value. There is one dominating value and one value only used for seperating. Once understood detect how many seperated regions of the dominating value there is and use the outcome as dimensions. If there 3 seperated regions of the dominating value horizontally and 5 vertically then create a output which is 3x5 and fully filled with the dominating value. Dimension: The dimension is key here and depends on the amount of seperated regions of the dominating value horizontally and vertically. Values: The only used value is the dominating value of the input. Changed values: Once the grid with the right dimension is created fill each entry with the dominating value.
137eaa0f;Look at the input and detect the different connected non-zero structures. Each has one five value to it. To produce the output one has to create a 3x3 grid and first put the 5 value in the middle entry. Then one has to fill the rest of the grid in the same manner in which the non-zero values are located to the 5 value. Dimension: The output dimension is a 3x3 grid. Values: All values used in the output grid were seen in the input. Changed values: There is no real changing of values since the output grid is built step by step.
150deff5;First the input is copied then one has to divide the structure consisting of 5s into parts of 2x2 squares and 3-entry lines (no matter if they horizontal or vertical). Once this classification is done turn all 2x2 sections into the value 8 and all lines with length 3 into the value 2. Dimension: The dimension is the same since we copy the input and then just change values and don't extend anything. Values: The used values in the output will only be 0,2, and 8. Changed values: Change every non-zero values to 8 or 2 depending on the classification necessary to seperate the strucutre distinctively into these two types of structures.
178fcbfb;First copy the input and then detect all the non-zero values. Once they got detected extend 2 values into a vertical line of 2s and extend 3s and 1s into horizontal lines of 3s or 1s respectively. If lines cross at an entry choose the horizontal line value. Dimension: The dimension in the input and the output stays the same since the input is copied and then only values are changed but the grid is not extended. Changed values: Only value in a vertical line to a 2 or in a horizontal line to a 3 or 1 are changed.
1a07d186;First the input is copied and one has to detect the vertical lines of non-zero values. Once they are understood look at the freely distributed non-zero values not being part of a vertical line. Each of these values is pulled towards the vertical line with the same value like gravity such that it ends up being a one-entry-extension into a horizontal direction of the line. If the value was located on the left site of the line it will extend the line in that row to the left site by one value. Vice versa on the right site. At the end once all freely distributed values with partner lines have been combined turn each value without direct connection to a vertical line to zero. Dimension: The dimension stays the same since the input is only copied but not extended. Neither does it follow another rule causing the output dimension to differ from the input dimension. Values: The used values in the output will only by the values represented in a vertical line in the input and zero. Changed values: All freely distributed non-zero values without partner line will be turned to zero. The left or right neighboring entry to a line will be turned to the value of the line if there is a partnering freely lying value in that row to the left or right of that line.
1b2d62fb;In the input are two 5x3 sections divided by a vertical line of 1s. Look at both sections and search for the positions where both 5x3 grids have a zero value. Then create an output grid with only 0s of the dimensions 5x3. Then change the value of the positions where both sections of the input have a zero into the value 8. Dimension: Following to the overall rule the output dim will be 5x3. Values: The only used values in the output will be 0 and 8. Changed values: As explained in the overall rule only change the positions where both sections of the input have a 0 into and 8 in the 5x3 output grid.
1b60fb0c;First copy the input and then observe the unfinished structure where 3 time the same structure is shown with values of 1s. Complete the structure such that it is symmetric by adding the unfinished part with values of 2s. Dimension: The dimension of the output is the same as the dimension in the input. Values: Only values 0,1, and 2 are used in the output. Changed values: 0s which are in the position where the unfinished structure should be are changed to 2s.
1bfc4729;Copy the input and then look at the structure the other output examples created. Do the same but with the two non-zero values shown in the current input. Dimension: The dimension stays the same since the input is only copied and changed but not extended. Values: The used values in the output are only 0 and the two non-zero values of the input. Changed values: 0s which are in a position where the final structure should be are turned into distance-wise nearest non-zero value.
1c786137;First one has to detect the frame indicated by one constant non-zero value. Once this is done just look at the entries in the frame and use exactly them with the respective dimensions as output. Dimension: Depends on the region in the frame. Values: Used values in the output are all seen in the frame of the input. Changed values: No values are changed at all only the region the frame is copied.
