Key;Reasoning
3ac3eb23;Copy the input and then extend from each non-zero value at the top the structure that has been seen in the task demonstrations. Do it downwards until the boundaries of the grid are reached. Dimension: The output-dim matches the input-dim since the input is copied and only modified value-wise. Values: All values used in the output have been seen in the input. Changed values: Change the values which need to be changed to creat the structures from the task demonstrations.
3af2c5a8;To get the output from the input first create a grid and double each dimension of the input. Then look at the output-grid as 4 sections because in principle the input grid can be added 4 times into the output grid since the dimensions got doubled. In the top left section insert the input as it has been seen. In the top right section insert the input mirrored at the y-axis. In the bottom left section inser the input mirrored at the x-axis. In the bottom right section insert the input mirrored at the x-axis and the y-axis. Dimension: The output dimensions is doubled across each dimension. Values: All values used in the output have been seen in the input. Changed values: There is not really a value-change occuring since the input is just mirrored in different ways and then inserted into the output grids sections.
3bd67248;Copy the input and turn each value of the bottom which is 0 into 4. Then turn each 0 on the diagonal from the bottom left to the top right into 2. This is the output. Dimension: Since the input is copied and only changed value-wise the output-dim matches the input-dim. Values: The values used in the output are 0, 2, 4, and the ones seen in the input. Changed values: Change values which are zero and in the bottom row or in the diagonal from bottom left to top right.
3bdb4ada;Copy the input and then modify the middle row of each connected non-zero rectangle such that it is alternating the value of the structure and 0s. Dimension: The output-dim matches the input-dim since the input is copied and then only modified value-wise. Values: The values used in the output are the same that has been used in the input. Changed values: Change only non-zero values to zero like described to create alternating middle rows of the structures.
3befdf3e;First copy the input and identify the trigger structures. There are two different triggers - one for the 3x3 connected non-zero structure and another for the 4x4 connected non-zero structure. Then translate each trigger having the 3x3 trigger by flipping the color order and adding another layer. Translate the 4x4 trigger by again flipping the color order and extending by a doubled outer layer. Dimension: The output-dim matches the input-dim. Values: All values used in the output have been seen in the input. Changed values: Change each value of the trigger plus the outer neareast layer of 0s to the triggers.
3c9b0459;To go from the input to the output just dot reflect the input at the middle entry. Dimension: Since input is just mirrored the output-dim matches the input-dim. Values: Since only mirrored the values used stay the same from input to output. Changed values: Depends on the reflecting value, but usually every value is changed except the middle one.
3de23699;First copy the input and then look at the edge values which frame some kind of region. Then copy the structure these edge values frame and change the non-values to the value of the edge value while keeping the structure the same. Dimension: The output-dim depends on the region framed by the edge values. Values: Only the edge value and 0 will be used in the output. Changed values: There is not really a change in values happening except for the non-zero values that are turnt into the edge value.
3e980e27;First copy the input and look at the example structures. If the example structure has a 3 as trigger value it will be triggered by each single 3 in the rest of the grid. Same with the value two just that when being triggered by value 2 the structure is reflected on the y-axis and then inserted. Dimension: The output-dimension matches the input-dimension. Values: All values used in the output have been seen in the input already. Changed values: Change only zero values that need to be changed since a trigger value triggered the insertion of a reference structure.
3eda0437;Copy the input and look for the largest rectangular shaped area of zeros. Turn each value in this area from 0 into 6. Dimension: The input has been copied and then just changed on a value-basis therefore the output-dim matches the input-dim. Values: The values used in the output have all been seen in the input already except for the 6. Changed values: Only change 0s which are in the area of the largest rectangle of 0s.
3f7978a0;Look at the input and find the two vertical lines which have 8s on the edges and 5s inbetween them. Copy them and the area between both of them and use exactly this with its dimensions as output. Dimension: The output-dim depends on the ares the two lines have between them and how long the lines are. Values: The values used in the output will only be 0, 5, and 8. Changed values: There is no change in values happening since basically only a subset of the input is copied to create the output.
4093f84a;Act as if all freely distributed non-zero values are gravitated to the pillar of 5s. Once they are pulled towards the pillar change them to the value five as well. All other values should be zero. Dimension: The output-dim matches the input-dim since the input is copied and then just changed on a value-basis. Values: Only 0s and 5s will be used in the output. Changed values: The values changed are all freely distributied non-zero values and the positions where they been earlier.
41e4d17e;First copy the input and then insert horizontal and vertical lines of the value 6 such that they cross at the middle entry of the frame of 1s. But be cautious because the lines of 6 should only overwrite 8s and never should a 6 overwrite a 1. Therefore in the final output the frame of 1s will be complete while there will be lines of 6 where earlier the value 8 was. Dimension: Since we copy the input and just change it value-wise the output-dim matches the input-dim. Values: The value used in the output will only be 1, 6, and 8. Changed values: Change entries which have the value 8 and lie on a horizontal or vertical line with the middle entry surrounded by a frame of 1s.
4258a5f9;Copy the input and look for the non-zero values. Frame each of the found non-zero values with a frame of 1s such that each direct neighbor (diagonal neighbors included) have the value 1 now. Dimension: Since the input is copied and then just changed value-wise the output-dim matches the input-dim. Values: The values used in the output are 0, 5, and 1. Changed values: All 0s being the direct neighbor of a 5 will be changed when going from input to output.
4290ef0e;Look at the input, there is one base value and then there are corner stones of rectangles given. Sort the cornerstones with the same value after size of rectangle they would span up if they were connected. Then create the output grid by first choosing the dimension of the largest rectangle spanned up. Insert now all cornerstones into the grid from largest to smallest and fill the resulting 0s up with the base value of the input. Dimension: The output-dim is defined by the largest rectangle spanned up by cornerstones having the same value. Values: The values used in the output are all values used in cornerstone plus the base value of the input. Changed values: There is no change in values happening since the output is built from the ground up.
42a50994;Copy the input and turn each non-zero entry which has no direct neighbor (including the diagonal neighbors) with a non-zero value into 0. This gives the output. Dimension: Since the input is copied and then only changed value-wise the output-dim matches the input-dim. Values: The values used in the output have all been seen in input already. Changed values: Change all values being non-zero which don't have a direct neighbor being non-zero too.
4347f46a;Copy the input and then turn for every rectangle its inside into zero values such that only the outlines of the rectangle remain non-zero. Dimension: Since the input is copied into the output and then only changed value-wise the output-dim matches the input-dim. Values: All values used in the output have been seen in the input already. Changed values: Change each non-zero value being in the inside of a rectangle filled with non-zero values.
444801d8;Copy the input and then look at the vessels with value 1. Each of them has another non-zero value in it unequal to 1. Now fill the whole vessel of 1s with the other non-zero value plus also add one line above the vessel such that it matches the width of the vessel itself. Dimension: The output-dim matches the input-dim since the input is copied and then only changed value-wise. Changed values: Change each zero value in the vesser plus all zero values one row above the vessel. But only manipulate the row above the vessel such that it builds a line with the width of the vessel itself.
445eab21;Look at the input there are two outlines of rectangles. Count how many zero values each of them surrounds then create a 2x2 output grid filled with the value the outlines of the max. area rectangle has. Dimension: The output dimension is independent from the input always 2x2. Values: The only used value in the output is the outline value of the rectangle surrounding the most zero values. Changed values: There is no change in values happening since the output is built from the ground up.
447fd412;Copy the input and understand the fulfilled connected structure having 1s and 2s. There are some freely distributed 2s which indicate that there should another fulfilled strucutre be built. Do exactly that such that none of the existing non-zero values have to be changed and they seemingly are used to be part of the newly built structures. Also if the freely distributed 2s are a 2x2 structure then double the size of the built structure if they are 3x3 triple the size of the structure etc. Values: All values used in the output have been seen in the input already. Changed values: Change the 0s being in the positions the new structures are built such that the original structure is rightly represented.
44d8ac46;Copy the input and look at the non-zero valued structures. For each of them look at the 0s they surround, if they surround an area of 0s having the shape of a square then turn the 0s into a 6. If the 0 area has another shape then they should remain being 0s. Dimension: The output-dim matches the input-dim since the input is just copied and then only changed on a value-basis. Values: The only used values in the output are 0, 5, and potentially 6 if the requirements above are met at least once. Changed values: Change 0 values with the shape of a square being surrounded by 5s.
44f52bb0;Look at the input, if the input is symmetrical w.r.t. the middle column then the output is 1x1 grid with the value 1. If it is not symmetrical then the output is a 1x1 grid with the value 7. Dimension: The output-dim is independent from the input-dim a 1x1 grid. Values: The value used depends only on the question if the input is symmetrical w.r.t. the middle column or not. Changed values: There is no changing values happening.
4522001f;The input shows a square non-zero valued structure. First create the output grid with dimension 9x9 and then place a 4x4 square of value 3 into the corner the square was in the input. Put another 4x4 square of 3s to the neighboring diagonal entry of the already existing 4x4 square. Only put it to the neighboring diagonal entry at the one corner which has the value 2 in the input. Dimension: The dimension of the output is 9x9 independent from the input dimension. Values: The values used in the output are 0 and 3. Changed values: There is no change in values happening since the output is built from the ground up.
4612dd53;Copy the input and understand that the input is just a few lines of 1s destroyed by zero values which break the lines. Connect the lines by turning the misplaced 0s into 6s. Dimension: The output-dim matches the input-dim since the input is just copied and then changed on a value-basis. Values: Only use 0, 1, and 6 in the output. Changed values: Change 0s which break the straight lines of the 1s.
46442a0e;Look at the input then create a grid with double the dimensions. Imagine the input as a square of value and insert it into the top left corner as it has been seen in the input. Insert it into the bottom left corner but imagine the input square being flipped to the left. Insert it into the bottom right corner but imagine it upside down. Insert it into the top right corner but imagine it being flipped to the right. Dimension: The output-dim depends on the input-dim and is doubled across each dimension. Values: The values used in the output have all been seen in the input already. Changed values: There is no change in values happening since the output is built from the ground up.
469497ad;Look at the input and count how many different non-zero values there are. Assume you counted x different non-zero values - reproduce the input-grid but x times the size it was in the input. Once done look at the square shaped connected non-zero structure and let a diagnoal line go out of each corner with the value 2 until a boundarie or another non-zero value is hit. Dimension: The input defines the output dimension because the input has to be reproduced but times x sized. Assume x is the amount of different non-zero value have been counted in the input. Values: All values used in the output have been seen in the input except the 2. Changed values: There is no change in values happening except for the diagonal lines exceeding the corners of the square structure. In that case change 0 values along that diagonal line into 2.
46f33fce;First produce a grid filled with 0s with the dimensions 20x20. Then put for each entry wherea non-zero values was in the input a 4x4 grid with that non-zero value in the output grid. This gives the output. Dimension: The output dimension is double the dimension of the input. Values: All values used in the output have been seen in the input. Changed values: There is no change in values happening since the output is built from the ground up.
47c1f68c;The input is divided into four regions splitted by lines having a uniform non-zero value. One of the regions has a connected non-zero structure in it. Create a output grid with dimensions being one less on each dimension and insert the structure seen in the input with the value of the dividing lines into each corner. Reflect the strucutre respectively, i.e. if the structure is inserted into the the bottom left corner reflect it at the x-axis. If it is inserted at the top right corner reflect it at the y-axis. If it is inserted into the bottom right corner reflect it at both axes. Dimension: As mentioned earlier if the input dimension is AxA the output dimension is (A-1)x(A-1). Values: The only used values in the output are 0 and the non-zero value dividing the regions in the input. Changed values: Change the values such that they resemble the input structure reflected differently as described.
484b58aa;Copy the input and then turn each zero value into a non-zero value such that the indicated pattern is fulfilled again. To do that look for each zero value into environments of the input which look similar and then change the zero value in such a manner that stays in line with pattern and the region looking similar to the zero value. Dimension: The output-dim matches the input-dim since the input is copied and then just changed value-wise. Values: All values used in the output have been seen in the input already. Changed values: Change all zero values of the copied input into non-zero values depending on what is needed to stay in line with the overall pattern.
48d8fb45;Look at the input, there are several connected non-zero structures. One of them is connected to a 5. Copy the one connected to the 5 but without the value 5 into an output grid which exactly fits the described structure one time. Dimension: The output-dim depends on the structure being connected to the value 5. Changed values: There is no value changed but a certain structure is copied and used as output.
4938f0c2;Copy the input and then mirror the connected structure with only two values around the square of 3s. Dimension: The input is copied and then changed only value-wise therefore the input-dim matches the output-dim. Values: All values used in the output have been seen in the input already. Changed values: Change the values around the 2x2 square of 3s such that the zero values which are in the position which will be occupied by the mirrored 2 structure are turned into 2s righfully.
496994bd;Copy the input and just reflec the connected non-zero structure at the top onto the bottom. This gives the final output. Dimension: Since the input is copied and then just changed on a value-basis the input-dim matches the output-dim. Values: All values used in the output have been seen in the input already. Changed values: All values at the bottom of the copied input grid are changed to the extent that they resemble the structure at the top but reflected horizontally.
49d1d64f;Each value in a corner of the input will be an arrow with the same value shaped towards the middle of the grid in the output. Each value in a row or column which is not in a corner in the input and also is not in the perfect middle of the input will be a 2 entry long line with the respective value in the output. Each value in the input being exactly in the middle of the input will be just the value perfectly in the middle of the output. Dimension: Exceed the input dimension such that exactly the named rules can be applied to the input and the result perfectly fits into the grid. Values: All used values in the output have been seen in the input already. Changed values: Since strict rules are applied and the input is never copied and then changed, there is not really a change in values happening.
4be741c5;Look at the input, there are several regions of uniformly connected non-zero regions. For each different non-zero value across these regions turn one value in the input into that value. Also note how they are aligned, meaning are the regions splitted from top to bottom or from left to right roughly speaking. Depending on the alignment the output will have different dimensions. Dimension: The output-dim depends on the alignment and the amoung of regions in the input. E.g. if there are three differently valued regions aligned from top to bottom the output will have dimensions 3x1. If there 4 differently valued regions from left to right the output will have dimensions 1x4. Values: All values used in the output have been seen in the input already. Changed values: This is not applicable here since the output is built from the ground up.
4c4377d9;Create a grid two times the height of the input grid but with the same width. Then copy the input as seen into the upper half of the output grid. Reflect the input horizontally and put it into the lower half of the output grid. This gives the final output. Dimension: The output dimension is doubled w.r.t. height but stays the same when it comes to width. Values: All values used in the output have been seen in the input. Changed values: There is change in values happening just reflecting and copying.
4c5c2cf0;Copy the input and detect the two connected non-zero structures with different values. One of them is the static one - around this one the other structure will be copied mirrored and inserted. The other one is the structure being copied mirrored and inserted. Once the copying mirroring and inserting is done the final output is given. Dimension: The output-dim matches the input-dim since the input is copied and then only changed value-wise. Values: The values used in the output have all been seen in the input already. Changed values: Change the zero values being in positions the mirrored structure should be in such that the mentioned effect of mirroring occurs.
508bd3b6;Copy the input, there is one wall of value 2 and one indicated diagonal line with the value 8. Continue the diagonal line by using the value 3. The diagonal line bounces of at the wall of 2s and ends when it hits the boundarie of the grid. Dimension: The input dimension matches the output dimension since the input is only copied and then changed on a value-basis. Values: Use the same values seen in the input plus 3. Changed values: Zero values lying on the indicated diagonal line will be changed plus zero values lying on the bounced of path of the indicated diagonal line will be changed.
50cb2852;Copy the input and detect the different rectangles. Change each rectangle such that the inner values of the rectangle all are 8 but the outlines remain the same as in the input. This gives the final output. Dimension: The output-dim matches the input-dim since the input is copied and then only changed value-wise. Values: The values used in the output are the same values that have been used in the input except for the 8. Changed values: All inner values of the copied rectangled will be changed until they are all 8.
5117e062;In the input are many connected non-zero structures but only one have them has incorporated an 8. Copy this structure incorporating an 8 but turn the 8 into value used for the rest of the structure, then use this new structure as output. Choose the dimension such that the constructed structure fits exactly into that grid. Dimension: The output dimension is chosen such that the copied structure fits perfectly into it. Values: Only use 0 and the value of the chosen structure in the output. Changed values: Not really applicably except for the 8 which is turnt into the base value of the chosen structure.
5168d44c;Copy the input and shift the frame consisting of 2s to the right if the alternating 0/3 line is horizontal and shift the frame downwards one step if the alternating line is vertical. With step I mean that the new center of the frame consisting of 2s is now the next 3 value in line. Dimension: The input-dim matches the output-dim since the input is only copied and then changed on a value-basis. Changed values: The value of the copied input are changed such that the effect appears that the frame of 2s shifte by one step into the explained direction.
539a4f51;Double the grid dimensions and then copy the input into the top left corner. Then repeat the pattern of the input such that the whole output-grid is filled with non-zero values. Dimension: The output-dim is double the input-dim. Values: All values used in the output have been seen in the input before. Changed values: Change the zero values of the created grid such that the pattern of the input grid is repeated.
53b68214;Copy the input then extend the grid dimension to 10x10 and continue the patter until it reaches the edge of the extended grid. Dimension: The copied output will always be extended to be in a 10x10 grid therefore the output-dim is 10x10. Values: The values used in the output have already been seen in the input. Changed values: Change the zero values added by extending the grid into the continued structure as described above.
543a7ed5;Copy the input and then put a frame of 3s around each connected structure of 6s. Then look for 8s being surrounded by 6s, if some are found turn these eights into 4s. Dimension: The output-dim matches the input-dim. Changed values: Changed 8s which are direct neighbors of 6s.
54d82841;Copy the input then look at the uniformly values non-zero structures, each of them has an opening towards the bottom. For each column in which such an opening lies turn the bottom value of that column into a 4. Dimension: The input is copied and then only changed on a value-basis therefore the input-dim matches the output-dim. Values: All values used in the output have been seen in the input before except for the 4s added at the bottom. Changed values: As explained look in each column for such an opening and if one is found then turn the bottom value of that column into a 4.
54d9e175;First copy the input and look at it like sections divided by 5s. Turn all values in a section into uniform values based on the following rules: 1->6, 2->7,3->8, and 4->9. This gives the final output. Dimension: The output-dim matches the input-dim since it is only copied and changed on a value basis. Values: As described the 5s stay the same but all other values transition as described earlier. Changed values: Each section of the copied input changes its values completely. 
5521c0d9;Copy the input and then shift each connected non-zero structure above the bottom by the amount of entries it is high. E.g. if a structure has a height of two there should be two zero values between the bottom of the shifted structure and the bottom of the grid. Dimension: The input-dim matches the output-dim. Values: All values used in the output have been seen in the input already. Changed values: Change the values above the structures such that the effect of shifting them up appears. Also change the values where they were earlier to 0 such that the space between the structure and the bottom of the grid is created.
5582e5ca;Look at the input and count which value occurs most frequently. Create a 3x3 grid filled with the most frequent value. This gives the output. Dimension: The output dimension is 3x3. Values: The only used value in the output is the one that has been most frequent in the input. Changed values: This is not applicable in this case.
